CardID	Unnamed: 1	Name	Rarity	Type	Cost	Essence	KLInfo	Power	Toughness	Domain	RulesText	Stats	imageUrl			
EC-181		Starlit Fox Companion	Adept	Avatar — Companion	1						Attach to an Avatar you control. Attached Avatar gets +1 Essence. When that Avatar deals Essence damage to a Deity, you may draw 1 card, then discard 1 card.		https://cdn1.sharemyimage.com/2025/12/05/65.png			
EC-182		Crownwatch Seraph	Adept	Avatar — Companion	2						Attach to a Deity. While attached, Spells that target your Deity cost opponents 1 more Essence. When you claim a Shard, heal 1 Essence to your Deity.		https://cdn1.sharemyimage.com/2025/12/05/66.png			
EC-183		Veilrunner Guide	Adept	Avatar — Companion	2						Attach to an Avatar. Whenever that Avatar enters or leaves New Earth, scry 1. If you control 3 or more Shards, attached Avatar also gets +1 attack.		https://cdn1.sharemyimage.com/2025/12/05/67.png			
EC-184		Shardwarden Familiar	Adept	Avatar — Companion	3						Attach to an Avatar or Deity. While attached, the first time each Cycle you would lose a Shard, you may instead pay 2 Essence to prevent that loss.		https://cdn1.sharemyimage.com/2025/12/05/68.png			
EC-185		Crownshock Decree	Arcane	Spell	2						Target Avatar loses 2 Essence. If you control a Domain, that Avatar also cannot attack this Cycle.		https://cdn1.sharemyimage.com/2025/12/05/69.png			
EC-186		Shardweave Insight	Arcane	Spell	1						Look at the top 3 cards of your Veiled Deck. You may reveal an Avatar or Companion among them and put it into your hand. Put the rest back in any order.		https://cdn1.sharemyimage.com/2025/12/05/70.png			
EC-187		Solar Aegis Veil	Arcane	Spell	2						Until end of Cycle, prevent the next 3 Essence damage that would be dealt to you or an Avatar you control. If you control 2 or more Shards, draw 1 card.		https://cdn1.sharemyimage.com/2025/12/05/71.png			
EC-188		Voidrift Grasp	Arcane	Spell	3						Return target Avatar from New Earth to its owner’s hand. Then that player discards a card.		https://cdn1.sharemyimage.com/2025/12/05/72.png			
EC-189		Sunspine Halberd	Arcane	Relic	2						Attach to an Avatar. Attached Avatar gets +1 attack and 'When this Avatar defeats another Avatar, gain 1 Essence.'		https://cdn1.sharemyimage.com/2025/12/05/73.png			
EC-190		Riftbound Shackles	Arcane	Relic	1						Attach to an opposing Avatar. That Avatar enters and remains exhausted (cannot attack) unless its controller pays 1 Essence at the start of their Combat each Cycle.		https://cdn1.sharemyimage.com/2025/12/05/74.png			
EC-191		Prism Crown Signet	Arcane	Relic	2						Attach to a Deity. Once per Cycle, when you cast a Spell, you may pay 1 Essence. If you do, draw 1 card, then discard 1 card.		https://cdn1.sharemyimage.com/2025/12/05/75.png			
EC-192		Nullsteel Reliquary	Arcane	Relic	3						Attach to a Deity or Avatar. As long as this Relic is attached, effects your opponents control cannot move cards from your Veiled Deck to your Void.		https://cdn1.sharemyimage.com/2025/12/05/76.png			
EC-193		Dawnspire Plateau	Arcane	Domain	1						At the start of your Cycle, you may heal 1 Essence to an Avatar you control. Whenever an Avatar you control is healed, it gets +1 attack this Cycle.		https://cdn1.sharemyimage.com/2025/12/05/77.png			
EC-194		Abyssal Echo Courts	Arcane	Domain	2						Spells that target cards in any Void cost 1 less Essence. At the start of each player’s End Phase, that player may move 1 card from their Void to the bottom of their Veiled Deck.		https://cdn1.sharemyimage.com/2025/12/05/78.png			
EC-195		Glass Meridian Walk	Arcane	Domain	2						When this Domain enters New Earth, scry 2. Avatars that attack alone get +1 Essence until end of Combat.		https://cdn1.sharemyimage.com/2025/12/05/79.png			
EC-196		Silent Shard Sanctum	Mythic	Domain	0						You may only include 1 copy of Silent Shard Sanctum in your deck. While this Domain is active, players cannot claim more than 2 Shards per Cycle.		https://cdn1.sharemyimage.com/2025/12/05/80.png			
EC-197		Starflare Crown Shard	Shard	Shard							When you claim Starflare Crown Shard, deal 2 Essence damage divided as you choose among up to two opposing Avatars. Crownbound — Your Avatars have +1 attack while attacking a player with more Shards than you.		https://cdn1.sharemyimage.com/2025/12/05/1acf423ea71c4f2aa.png			
EC-198		Deepwake Crown Shard	Shard	Shard							When you claim Deepwake Crown Shard, heal 2 Essence to your Deity. Crownbound — At the start of your Cycle, if you control 3 or more Shards, you may heal 1 Essence to an Avatar you control.		https://cdn1.sharemyimage.com/2025/12/05/2547c1124d72dae04.png			
EC-199		Riftveil Crown Shard	Shard	Shard							When you claim Riftveil Crown Shard, look at the top 2 cards of your Veiled Deck; you may move any number of them to your Void and the rest back on top. Crownbound — Spells you cast that reference the Void cost 1 less Essence.		https://cdn1.sharemyimage.com/2025/12/05/381b3e1b1782cc682.png			
EC-200		Gloomglass Crown Shard	Shard	Shard							When you claim Gloomglass Crown Shard, an opponent of your choice discards a card. Crownbound — Once per Cycle, when an opponent discards a card, you may draw 1 card, then discard 1 card.		https://cdn1.sharemyimage.com/2025/12/05/42c08abdf80694f5d.png			
EC-201		Rite of Sunfall Reprieve	Arcane	Rite	4						Choose up to two Avatars you control. Each gains +2 Essence until end of Cycle. If you control 2 or more Shards, those Avatars also get Guardian this Cycle.		https://cdn1.sharemyimage.com/2025/12/05/51e0aee3a07b7e6ec.png			
EC-202		Rite of Voidbound March	Arcane	Rite	5						Return up to two Avatars from your Void to your hand. If you returned two, you may Manifest one of them with Essence Cost 3 or less without paying its Essence cost.		https://cdn1.sharemyimage.com/2025/12/05/61b698ed7692d8f4e.png			
EC-203		Rite of Mirror Crown	Arcane	Rite	3						Until end of Cycle, whenever an opponent casts a Spell, you may pay 1 Essence. If you do, copy that Spell and choose new targets for the copy.		https://cdn1.sharemyimage.com/2025/12/05/7db52ee0b98440298.png			
EC-204		Rite of Cracked Horizon	Arcane	Rite	6						Destroy all Domains on New Earth. Each player then may search their Veiled Deck for a Domain card, reveal it, put it into their hand, then shuffle.		https://cdn1.sharemyimage.com/2025/12/05/8da7bc6c39df03534.png			
EC-205		Ember-Crown Wisp	Adept	Avatar — Token							Token Avatar (cannot be included in decks). 1 Essence, 1 attack. When this Avatar is sacrificed, deal 1 Essence damage to any target.		https://cdn1.sharemyimage.com/2025/12/05/95827cfd0fb618439.png			
EC-206		Shardmist Phantom	Adept	Avatar — Token							Token Avatar (cannot be included in decks). 1 Essence, 0 attack. This Avatar cannot be blocked. At the end of your Cycle, sacrifice it unless you pay 1 Essence.		https://cdn1.sharemyimage.com/2025/12/05/1062ba973acd459fab.png			
EC-207		Veil-Fragment Sprite	Adept	Avatar — Token							Token Avatar (cannot be included in decks). 0 Essence, 1 attack. When this Avatar enters New Earth, draw 1 card, then discard 1 card.		https://cdn1.sharemyimage.com/2025/12/05/115c279b421d251ca7.png			
EC-208		Crownforge Sentinel	Adept	Avatar — Token							Token Avatar (cannot be included in decks). 2 Essence, 0 attack. Guardian. When this Avatar is defeated, you may heal 1 Essence to your Deity.		https://cdn1.sharemyimage.com/2025/12/05/128b0f8160ffc4c0ab.png			
EC-209		Shardline Reservoir	Arcane	Essence	0						Once per Cycle, exhaust this: add 1 Essence for each Shard you control, usable only to cast Spells.		https://cdn1.sharemyimage.com/2025/12/05/1345df80ae817e9567.png			
EC-210		Radiant Channel Node	Arcane	Essence	0						When this enters play, if you control an Avatar, heal 1 Essence. Once per Cycle, exhaust this: add 1 Essence of any type.		https://cdn1.sharemyimage.com/2025/12/05/1480640dc97a1dcfab.png			
EC-211		Voidstream Lattice	Arcane	Essence	0						Once per Cycle, you may move the top card of your Veiled Deck to your Void. If you do, add 2 Essence usable only to cast Rites.		https://cdn1.sharemyimage.com/2025/12/05/154138d85980b19cca.png			
EC-212		Balanced Shard Conduit	Arcane	Essence	0						At the start of your Cycle, choose Avatars or Spells. Until end of Cycle, the first card of the chosen kind you cast costs 1 less Essence.		https://cdn1.sharemyimage.com/2025/12/05/164d6781514b0bc3a9.png			
EC-213		Dawnflare Guide-Beast	Adept	Avatar — Companion	1						Attach to an Avatar. Attached Avatar gets +1 Essence. When attached Avatar enters New Earth, scry 1.		https://cdn1.sharemyimage.com/2025/12/05/17c522abbe40d411fd.png			
EC-214		Voidwing Herald	Adept	Avatar — Companion	2						Attach to a Deity or Avatar. While attached, the first time each Cycle a card enters your Void from your Veiled Deck, you may draw 1 card and then discard 1 card.		https://cdn1.sharemyimage.com/2025/12/05/18e898b566450c9c7c.png			
EC-215		Shardveil Attendant	Adept	Avatar — Companion	2						Attach to a Deity. When you claim a Shard, heal 1 Essence to your Deity. If you control 4 or more Shards, attached Deity cannot be targeted by opposing Rites.		https://cdn1.sharemyimage.com/2025/12/05/1915661e93c3a54ac0.png			
EC-216		Mirrorstep Familiar	Adept	Avatar — Companion	3						Attach to an Avatar. Attached Avatar gets 'When this Avatar becomes the target of a Spell, you may move it to another open Avatar slot you control.'		https://cdn1.sharemyimage.com/2025/12/05/204af67c37a71deaf4.png			
BACK													https://cdn1.sharemyimage.com/2025/12/02/Back.png			
